{
  "schema_version": "1.0.0",
  "cue_id": "cue-rainbows-and-roses-mix-1",
  "title": "Rainbows And Roses",
  "artist": {
    "name": "That Boy Hi Hat",
    "tier": "VERIFIED",
    "note": "Artist of record."
  },
  "spotify": {
    "id": "2ZUYjQGsRLHRcsfgyeAWpo",
    "url": "https://open.spotify.com/track/2ZUYjQGsRLHRcsfgyeAWpo",
    "verified": true,
    "tier": "VERIFIED",
    "note": "Verified Spotify ID for catalog title 'Rainbows And Roses' (audio-features cross-check 2026-09-16)."
  },
  "mix": "Mix 1",
  "duration_s": 241,
  "duration_note": "Measured 2026-09-17 from Rainbows_And_Roses_Mix_1.mp3.",
  "audio": {
    "tempo_bpm": {
      "value": 85,
      "confidence": 0.509,
      "tier": "SAMPLE",
      "source": "cwi-in-house-analyzer 2026-09-17 (numpy onset-autocorrelation / Krumhansl)",
      "quote_allowed": true,
      "note": ""
    },
    "key": {
      "value": "A major",
      "correlation": 0.798,
      "tier": "SAMPLE",
      "source": "cwi-in-house-analyzer 2026-09-17 (numpy onset-autocorrelation / Krumhansl)",
      "note": "Strongest key read in the batch (0.798). Clean peak headroom (-0.4 dBTP)."
    },
    "loudness": {
      "lufs_integrated": -14.1,
      "true_peak_dbtp": -0.4,
      "tier": "SAMPLE",
      "source": "cwi-in-house-analyzer 2026-09-17 (EBU R128)"
    },
    "energy": {
      "value": "high",
      "tier": "SAMPLE",
      "source": "cwi-in-house-analyzer 2026-09-17",
      "note": "Analyzer energy bucket for the measured file."
    }
  },
  "genre": [
    {
      "value": "alternative rap",
      "tier": "VERIFIED",
      "note": "Genre per user (That Boy Hi Hat). Post-Trap Futurism is the artist's self-description."
    }
  ],
  "mood_tags": [],
  "mood_note": "Descriptive mood tags pending human annotation. Not machine-inferred. Measured energy and third-party audio features are provided as numbers for machine interpretation.",
  "scene_use": {
    "status": "unassessed",
    "note": "scene_use not assessed. Do not infer; sync availability requires rights review."
  },
  "instrumentation": {
    "status": "unassessed",
    "note": "instrumentation not assessed. Do not infer; sync availability requires rights review."
  },
  "lyrics": {
    "status": "withheld",
    "note": "Machine-draft transcriptions exist for some tracks but are rough and unpublished. Lyrics require Black's ear before publication. No lyric text is carried in this cue sheet."
  },
  "credits": [],
  "placements": [],
  "clearance": {
    "status": "amber",
    "meaning": "Clearance status unknown. Sync licensing requires rights review with the rights holder before any use. This cue sheet states no terms and makes no one-stop or pre-cleared claim.",
    "terms": "Not stated here. Contact the rights contact for terms.",
    "rights_contact": "hp@cumulativeweb.com"
  },
  "related": [],
  "provenance": {
    "cue_sheet_issued": "2026-09-17",
    "issuer": "agent:CWI_AandR (Lane D, Operation Conversion)",
    "measurement_method": "CWI in-house analyzer 2026-09-17: numpy onset-autocorrelation BPM, Krumhansl key, EBU R128 loudness. ESTIMATES, not Cyanite-grade.",
    "canonical_refs": [
      "llms.txt",
      "catalog.json",
      "entities.jsonld"
    ]
  },
  "notes": [
    "Canonical title: 'Rainbows And Roses (Mix 1)' (2026-09-17)."
  ]
}
