{
  "schema_version": "1.0.0",
  "cue_id": "cue-shaka-zulu",
  "title": "Shaka Zulu",
  "artist": {
    "name": "That Boy Hi Hat",
    "tier": "VERIFIED",
    "note": "Artist of record."
  },
  "spotify": {
    "id": "3pQEzg7xFqGIk0CK1Za1Kw",
    "url": "https://open.spotify.com/track/3pQEzg7xFqGIk0CK1Za1Kw",
    "verified": true,
    "tier": "VERIFIED",
    "note": "Verified Spotify ID (audio-features cross-check 2026-09-16)."
  },
  "mix": "v1 (16bit/44.1kHz master file)",
  "duration_s": 252,
  "duration_note": "Measured 2026-09-17 from That_Boy_Hi_Hat-Shaka_Zulu_v1_16bit44.1kHz.mp3.",
  "audio": {
    "tempo_bpm": {
      "value": 83,
      "confidence": 0.322,
      "tier": "SAMPLE",
      "source": "cwi-in-house-analyzer 2026-09-17 (numpy onset-autocorrelation / Krumhansl)",
      "quote_allowed": false,
      "note": "BPM tentative (0.32 confidence) — do NOT quote externally. Re-checked 2026-09-17 with autocorrelation candidate sweep: 83-84 BPM strongest peak, 110 BPM distant second."
    },
    "key": {
      "value": "D minor",
      "correlation": 0.694,
      "tier": "SAMPLE",
      "source": "cwi-in-house-analyzer 2026-09-17 (numpy onset-autocorrelation / Krumhansl)",
      "note": ""
    },
    "loudness": {
      "lufs_integrated": -12.3,
      "true_peak_dbtp": 0.1,
      "tier": "SAMPLE",
      "source": "cwi-in-house-analyzer 2026-09-17 (EBU R128)"
    },
    "energy": {
      "value": "high",
      "tier": "SAMPLE",
      "source": "cwi-in-house-analyzer 2026-09-17",
      "note": "Analyzer energy bucket for the measured file."
    }
  },
  "genre": [
    {
      "value": "alternative rap",
      "tier": "VERIFIED",
      "note": "Genre per user (That Boy Hi Hat). Post-Trap Futurism is the artist's self-description."
    }
  ],
  "mood_tags": [],
  "mood_note": "Descriptive mood tags pending human annotation. Not machine-inferred. Measured energy and third-party audio features are provided as numbers for machine interpretation.",
  "scene_use": {
    "status": "unassessed",
    "note": "scene_use not assessed. Do not infer; sync availability requires rights review."
  },
  "instrumentation": {
    "status": "unassessed",
    "note": "instrumentation not assessed. Do not infer; sync availability requires rights review."
  },
  "lyrics": {
    "status": "withheld",
    "note": "Machine-draft transcriptions exist for some tracks but are rough and unpublished. Lyrics require Black's ear before publication. No lyric text is carried in this cue sheet."
  },
  "credits": [],
  "placements": [
    {
      "playlist": "New Rap Hits",
      "position": 21,
      "observed_at": "2026-09-17",
      "tier": "VERIFIED",
      "note": "Via Audiartist submission #25821; holding per 2026-09-17 scan."
    }
  ],
  "clearance": {
    "status": "amber",
    "meaning": "Clearance status unknown. Sync licensing requires rights review with the rights holder before any use. This cue sheet states no terms and makes no one-stop or pre-cleared claim.",
    "terms": "Not stated here. Contact the rights contact for terms.",
    "rights_contact": "hp@cumulativeweb.com"
  },
  "related": [],
  "provenance": {
    "cue_sheet_issued": "2026-09-17",
    "issuer": "agent:CWI_AandR (Lane D, Operation Conversion)",
    "measurement_method": "CWI in-house analyzer 2026-09-17: numpy onset-autocorrelation BPM, Krumhansl key, EBU R128 loudness. ESTIMATES, not Cyanite-grade.",
    "canonical_refs": [
      "llms.txt",
      "catalog.json",
      "entities.jsonld"
    ]
  },
  "notes": [
    "Canonical title: 'That Boy Hi Hat – Shaka Zulu' (2026-09-17)."
  ]
}
